{
  "session": {
    "id": "s-002",
    "title": "Topic Return",
    "goal": "Topicの再訪とFlowを確認する",
    "status": "active",
    "created_at": "2026-09-19T11:00:00Z",
    "started_at": "2026-09-19T11:00:00Z",
    "ended_at": null,
    "graph_revision": 9
  },
  "evidence": [
    {
      "id": "evd-001",
      "session_id": "s-002",
      "sequence": 1,
      "timestamp": "2026-09-19T11:00:01Z",
      "speaker": "A",
      "text": "Discussion Mapを中心にしましょう"
    },
    {
      "id": "evd-002",
      "session_id": "s-002",
      "sequence": 2,
      "timestamp": "2026-09-19T11:00:02Z",
      "speaker": "B",
      "text": "Visual生成も欲しいですね"
    },
    {
      "id": "evd-003",
      "session_id": "s-002",
      "sequence": 3,
      "timestamp": "2026-09-19T11:00:03Z",
      "speaker": "C",
      "text": "価格の話もあります"
    },
    {
      "id": "evd-004",
      "session_id": "s-002",
      "sequence": 4,
      "timestamp": "2026-09-19T11:00:04Z",
      "speaker": "A",
      "text": "さっきのDiscussion Mapの話に戻ると"
    }
  ],
  "utterances": [
    {
      "id": "utt-001",
      "session_id": "s-002",
      "sequence": 1,
      "evidence_ids": ["evd-001"],
      "text": "Discussion Mapを中心にしましょう",
      "started_at": "2026-09-19T11:00:01Z",
      "ended_at": "2026-09-19T11:00:01Z"
    },
    {
      "id": "utt-002",
      "session_id": "s-002",
      "sequence": 2,
      "evidence_ids": ["evd-002"],
      "text": "Visual生成も欲しいですね",
      "started_at": "2026-09-19T11:00:02Z",
      "ended_at": "2026-09-19T11:00:02Z"
    },
    {
      "id": "utt-003",
      "session_id": "s-002",
      "sequence": 3,
      "evidence_ids": ["evd-003"],
      "text": "価格の話もあります",
      "started_at": "2026-09-19T11:00:03Z",
      "ended_at": "2026-09-19T11:00:03Z"
    },
    {
      "id": "utt-004",
      "session_id": "s-002",
      "sequence": 4,
      "evidence_ids": ["evd-004"],
      "text": "さっきのDiscussion Mapの話に戻ると",
      "started_at": "2026-09-19T11:00:04Z",
      "ended_at": "2026-09-19T11:00:04Z"
    }
  ],
  "graph": {
    "session_id": "s-002",
    "revision": 9,
    "last_event_sequence": 9,
    "nodes": [
      {
        "id": "node:s-002:evt-003",
        "session_id": "s-002",
        "type": "topic",
        "label": "Discussion Map",
        "status": "active",
        "created_at": "2026-09-19T11:00:03Z",
        "updated_at": "2026-09-19T11:00:03Z",
        "source_event_ids": ["evt-003"],
        "evidence_ids": ["evd-001"]
      },
      {
        "id": "node:s-002:evt-005",
        "session_id": "s-002",
        "type": "topic",
        "label": "Visual生成",
        "status": "active",
        "created_at": "2026-09-19T11:00:05Z",
        "updated_at": "2026-09-19T11:00:05Z",
        "source_event_ids": ["evt-005"],
        "evidence_ids": ["evd-002"]
      },
      {
        "id": "node:s-002:evt-007",
        "session_id": "s-002",
        "type": "topic",
        "label": "料金モデル",
        "status": "active",
        "created_at": "2026-09-19T11:00:07Z",
        "updated_at": "2026-09-19T11:00:07Z",
        "source_event_ids": ["evt-007"],
        "evidence_ids": ["evd-003"]
      }
    ],
    "edges": [],
    "current_topic": {
      "primary_topic_id": "node:s-002:evt-003",
      "mode": "derived",
      "confidence": 0.95,
      "source_event_ids": ["evt-009"]
    }
  }
}

