{
  "session": {
    "id": "s-004",
    "title": "Decision Revoke",
    "goal": "Confirmed Decisionの解除を確認する",
    "status": "active",
    "created_at": "2026-09-19T13:00:00Z",
    "started_at": "2026-09-19T13:00:00Z",
    "ended_at": null,
    "graph_revision": 5
  },
  "evidence": [
    {
      "id": "evd-001",
      "session_id": "s-004",
      "sequence": 1,
      "timestamp": "2026-09-19T13:00:01Z",
      "speaker": "A",
      "text": "Visual生成はMVPに含める"
    },
    {
      "id": "evd-002",
      "session_id": "s-004",
      "sequence": 2,
      "timestamp": "2026-09-19T13:00:02Z",
      "speaker": "Human",
      "text": "やはりMVPでは外す"
    }
  ],
  "utterances": [
    {
      "id": "utt-001",
      "session_id": "s-004",
      "sequence": 1,
      "evidence_ids": ["evd-001"],
      "text": "Visual生成はMVPに含める",
      "started_at": "2026-09-19T13:00:01Z",
      "ended_at": "2026-09-19T13:00:01Z"
    },
    {
      "id": "utt-002",
      "session_id": "s-004",
      "sequence": 2,
      "evidence_ids": ["evd-002"],
      "text": "やはりMVPでは外す",
      "started_at": "2026-09-19T13:00:02Z",
      "ended_at": "2026-09-19T13:00:02Z"
    }
  ],
  "graph": {
    "session_id": "s-004",
    "revision": 5,
    "last_event_sequence": 5,
    "nodes": [
      {
        "id": "node:s-004:evt-003",
        "session_id": "s-004",
        "type": "decision",
        "label": "Visual生成はMVPに含める",
        "status": "revoked",
        "created_at": "2026-09-19T13:00:03Z",
        "updated_at": "2026-09-19T13:00:05Z",
        "source_event_ids": ["evt-003", "evt-004", "evt-005"],
        "evidence_ids": ["evd-001", "evd-002"]
      }
    ],
    "edges": [],
    "current_topic": {
      "primary_topic_id": null,
      "mode": "derived",
      "source_event_ids": []
    }
  }
}
