{
  "session": {
    "id": "s-011",
    "title": "Replay Determinism",
    "goal": "Replay結果の完全一致を確認する",
    "status": "active",
    "created_at": "2026-09-19T20:00:00Z",
    "started_at": "2026-09-19T20:00:00Z",
    "ended_at": null,
    "graph_revision": 6
  },
  "evidence": [
    {
      "id": "evd-001",
      "session_id": "s-011",
      "sequence": 1,
      "timestamp": "2026-09-19T20:00:01Z",
      "speaker": "A",
      "text": "MVPはDiscussion Mapを中心にしたい"
    },
    {
      "id": "evd-002",
      "session_id": "s-011",
      "sequence": 2,
      "timestamp": "2026-09-19T20:00:02Z",
      "speaker": "B",
      "text": "Mapを見ながら話せるようにする"
    }
  ],
  "utterances": [
    {
      "id": "utt-001",
      "session_id": "s-011",
      "sequence": 1,
      "evidence_ids": ["evd-001"],
      "text": "MVPはDiscussion Mapを中心にしたい",
      "started_at": "2026-09-19T20:00:01Z",
      "ended_at": "2026-09-19T20:00:01Z"
    },
    {
      "id": "utt-002",
      "session_id": "s-011",
      "sequence": 2,
      "evidence_ids": ["evd-002"],
      "text": "Mapを見ながら話せるようにする",
      "started_at": "2026-09-19T20:00:02Z",
      "ended_at": "2026-09-19T20:00:02Z"
    }
  ],
  "graph": {
    "session_id": "s-011",
    "revision": 6,
    "last_event_sequence": 6,
    "nodes": [
      {
        "id": "node:s-011:evt-003",
        "session_id": "s-011",
        "type": "topic",
        "label": "MVPの中心価値",
        "status": "active",
        "created_at": "2026-09-19T20:00:03Z",
        "updated_at": "2026-09-19T20:00:03Z",
        "source_event_ids": ["evt-003"],
        "evidence_ids": ["evd-001"]
      },
      {
        "id": "node:s-011:evt-005",
        "session_id": "s-011",
        "type": "idea",
        "label": "Mapを見ながら話せる",
        "status": "active",
        "created_at": "2026-09-19T20:00:05Z",
        "updated_at": "2026-09-19T20:00:05Z",
        "source_event_ids": ["evt-005"],
        "evidence_ids": ["evd-002"]
      }
    ],
    "edges": [
      {
        "id": "edge:s-011:contains:node:s-011:evt-003:node:s-011:evt-005",
        "source_node_id": "node:s-011:evt-003",
        "target_node_id": "node:s-011:evt-005",
        "type": "contains",
        "source_event_ids": ["evt-006"]
      }
    ],
    "current_topic": {
      "primary_topic_id": "node:s-011:evt-003",
      "mode": "derived",
      "confidence": 0.94,
      "source_event_ids": ["evt-004"]
    }
  }
}

