{
  "session": {
    "id": "s-007",
    "title": "Parking Lot",
    "goal": "Parking LotとRestoreを確認する",
    "status": "active",
    "created_at": "2026-09-19T16:00:00Z",
    "started_at": "2026-09-19T16:00:00Z",
    "ended_at": null,
    "graph_revision": 7
  },
  "evidence": [
    {
      "id": "evd-001",
      "session_id": "s-007",
      "sequence": 1,
      "timestamp": "2026-09-19T16:00:01Z",
      "speaker": "A",
      "text": "Teams連携も将来検討したい"
    },
    {
      "id": "evd-002",
      "session_id": "s-007",
      "sequence": 2,
      "timestamp": "2026-09-19T16:00:02Z",
      "speaker": "A",
      "text": "Teams連携の話に戻ろう"
    }
  ],
  "utterances": [
    {
      "id": "utt-001",
      "session_id": "s-007",
      "sequence": 1,
      "evidence_ids": ["evd-001"],
      "text": "Teams連携も将来検討したい",
      "started_at": "2026-09-19T16:00:01Z",
      "ended_at": "2026-09-19T16:00:01Z"
    },
    {
      "id": "utt-002",
      "session_id": "s-007",
      "sequence": 2,
      "evidence_ids": ["evd-002"],
      "text": "Teams連携の話に戻ろう",
      "started_at": "2026-09-19T16:00:02Z",
      "ended_at": "2026-09-19T16:00:02Z"
    }
  ],
  "graph": {
    "session_id": "s-007",
    "revision": 7,
    "last_event_sequence": 7,
    "nodes": [
      {
        "id": "node:s-007:evt-003",
        "session_id": "s-007",
        "type": "topic",
        "label": "Teams連携",
        "status": "active",
        "created_at": "2026-09-19T16:00:03Z",
        "updated_at": "2026-09-19T16:00:06Z",
        "source_event_ids": ["evt-003", "evt-005", "evt-006"],
        "evidence_ids": ["evd-001"]
      }
    ],
    "edges": [],
    "current_topic": {
      "primary_topic_id": "node:s-007:evt-003",
      "mode": "derived",
      "confidence": 0.94,
      "source_event_ids": ["evt-007"]
    }
  }
}

