{
  "session": {
    "id": "s-001",
    "title": "Basic Discussion",
    "goal": "MVPの中心価値を整理する",
    "status": "active",
    "created_at": "2026-09-19T10:00:00Z",
    "started_at": "2026-09-19T10:00:00Z",
    "ended_at": null,
    "graph_revision": 9
  },
  "evidence": [
    {
      "id": "evd-001",
      "session_id": "s-001",
      "sequence": 1,
      "timestamp": "2026-09-19T10:00:01Z",
      "speaker": "A",
      "text": "MVPはDiscussion Mapを中心にしたいです"
    },
    {
      "id": "evd-002",
      "session_id": "s-001",
      "sequence": 2,
      "timestamp": "2026-09-19T10:00:02Z",
      "speaker": "B",
      "text": "文字起こしも必要ですよね"
    },
    {
      "id": "evd-003",
      "session_id": "s-001",
      "sequence": 3,
      "timestamp": "2026-09-19T10:00:03Z",
      "speaker": "A",
      "text": "必要ですが、中心価値ではないと思います"
    }
  ],
  "utterances": [
    {
      "id": "utt-001",
      "session_id": "s-001",
      "sequence": 1,
      "evidence_ids": ["evd-001"],
      "text": "MVPはDiscussion Mapを中心にしたいです",
      "started_at": "2026-09-19T10:00:01Z",
      "ended_at": "2026-09-19T10:00:01Z"
    },
    {
      "id": "utt-002",
      "session_id": "s-001",
      "sequence": 2,
      "evidence_ids": ["evd-002"],
      "text": "文字起こしも必要ですよね",
      "started_at": "2026-09-19T10:00:02Z",
      "ended_at": "2026-09-19T10:00:02Z"
    },
    {
      "id": "utt-003",
      "session_id": "s-001",
      "sequence": 3,
      "evidence_ids": ["evd-003"],
      "text": "必要ですが、中心価値ではないと思います",
      "started_at": "2026-09-19T10:00:03Z",
      "ended_at": "2026-09-19T10:00:03Z"
    }
  ],
  "graph": {
    "session_id": "s-001",
    "revision": 9,
    "last_event_sequence": 9,
    "nodes": [
      {
        "id": "node:s-001:evt-003",
        "session_id": "s-001",
        "type": "topic",
        "label": "MVPの中心価値",
        "status": "active",
        "created_at": "2026-09-19T10:00:03Z",
        "updated_at": "2026-09-19T10:00:03Z",
        "source_event_ids": ["evt-003"],
        "evidence_ids": ["evd-001"]
      },
      {
        "id": "node:s-001:evt-005",
        "session_id": "s-001",
        "type": "idea",
        "label": "Discussion Mapを中心にする",
        "status": "active",
        "created_at": "2026-09-19T10:00:05Z",
        "updated_at": "2026-09-19T10:00:05Z",
        "source_event_ids": ["evt-005"],
        "evidence_ids": ["evd-001"]
      },
      {
        "id": "node:s-001:evt-006",
        "session_id": "s-001",
        "type": "idea",
        "label": "文字起こしが必要",
        "status": "active",
        "created_at": "2026-09-19T10:00:06Z",
        "updated_at": "2026-09-19T10:00:06Z",
        "source_event_ids": ["evt-006"],
        "evidence_ids": ["evd-002", "evd-003"]
      }
    ],
    "edges": [
      {
        "id": "edge:s-001:contains:node:s-001:evt-003:node:s-001:evt-005",
        "source_node_id": "node:s-001:evt-003",
        "target_node_id": "node:s-001:evt-005",
        "type": "contains",
        "source_event_ids": ["evt-007"]
      },
      {
        "id": "edge:s-001:contains:node:s-001:evt-003:node:s-001:evt-006",
        "source_node_id": "node:s-001:evt-003",
        "target_node_id": "node:s-001:evt-006",
        "type": "contains",
        "source_event_ids": ["evt-008"]
      },
      {
        "id": "edge:s-001:related_to:node:s-001:evt-005:node:s-001:evt-006",
        "source_node_id": "node:s-001:evt-005",
        "target_node_id": "node:s-001:evt-006",
        "type": "related_to",
        "source_event_ids": ["evt-009"]
      }
    ],
    "current_topic": {
      "primary_topic_id": "node:s-001:evt-003",
      "mode": "derived",
      "confidence": 0.95,
      "source_event_ids": ["evt-004"]
    }
  }
}

