{
  "session": {
    "id": "s-006",
    "title": "Human Correction",
    "goal": "Rename、Merge、Archiveを確認する",
    "status": "active",
    "created_at": "2026-09-19T15:00:00Z",
    "started_at": "2026-09-19T15:00:00Z",
    "ended_at": null,
    "graph_revision": 9
  },
  "evidence": [
    {
      "id": "evd-001",
      "session_id": "s-006",
      "sequence": 1,
      "timestamp": "2026-09-19T15:00:01Z",
      "speaker": "AI",
      "text": "価格モデル"
    },
    {
      "id": "evd-002",
      "session_id": "s-006",
      "sequence": 2,
      "timestamp": "2026-09-19T15:00:02Z",
      "speaker": "AI",
      "text": "Visual生成"
    },
    {
      "id": "evd-003",
      "session_id": "s-006",
      "sequence": 3,
      "timestamp": "2026-09-19T15:00:03Z",
      "speaker": "AI",
      "text": "イメージ生成"
    },
    {
      "id": "evd-004",
      "session_id": "s-006",
      "sequence": 4,
      "timestamp": "2026-09-19T15:00:04Z",
      "speaker": "AI",
      "text": "一時的なメモ"
    }
  ],
  "utterances": [
    {
      "id": "utt-001",
      "session_id": "s-006",
      "sequence": 1,
      "evidence_ids": ["evd-001"],
      "text": "価格モデル",
      "started_at": "2026-09-19T15:00:01Z",
      "ended_at": "2026-09-19T15:00:01Z"
    },
    {
      "id": "utt-002",
      "session_id": "s-006",
      "sequence": 2,
      "evidence_ids": ["evd-002"],
      "text": "Visual生成",
      "started_at": "2026-09-19T15:00:02Z",
      "ended_at": "2026-09-19T15:00:02Z"
    },
    {
      "id": "utt-003",
      "session_id": "s-006",
      "sequence": 3,
      "evidence_ids": ["evd-003"],
      "text": "イメージ生成",
      "started_at": "2026-09-19T15:00:03Z",
      "ended_at": "2026-09-19T15:00:03Z"
    },
    {
      "id": "utt-004",
      "session_id": "s-006",
      "sequence": 4,
      "evidence_ids": ["evd-004"],
      "text": "一時的なメモ",
      "started_at": "2026-09-19T15:00:04Z",
      "ended_at": "2026-09-19T15:00:04Z"
    }
  ],
  "graph": {
    "session_id": "s-006",
    "revision": 9,
    "last_event_sequence": 9,
    "nodes": [
      {
        "id": "node:s-006:evt-003",
        "session_id": "s-006",
        "type": "topic",
        "label": "料金体系",
        "status": "active",
        "created_at": "2026-09-19T15:00:03Z",
        "updated_at": "2026-09-19T15:00:07Z",
        "source_event_ids": ["evt-003", "evt-007"],
        "evidence_ids": ["evd-001"]
      },
      {
        "id": "node:s-006:evt-004",
        "session_id": "s-006",
        "type": "topic",
        "label": "Visual生成",
        "status": "active",
        "created_at": "2026-09-19T15:00:04Z",
        "updated_at": "2026-09-19T15:00:08Z",
        "source_event_ids": ["evt-004", "evt-008"],
        "evidence_ids": ["evd-002"]
      },
      {
        "id": "node:s-006:evt-005",
        "session_id": "s-006",
        "type": "topic",
        "label": "イメージ生成",
        "status": "archived",
        "created_at": "2026-09-19T15:00:05Z",
        "updated_at": "2026-09-19T15:00:08Z",
        "source_event_ids": ["evt-005", "evt-008"],
        "evidence_ids": ["evd-003"]
      },
      {
        "id": "node:s-006:evt-006",
        "session_id": "s-006",
        "type": "topic",
        "label": "一時的なメモ",
        "status": "archived",
        "created_at": "2026-09-19T15:00:06Z",
        "updated_at": "2026-09-19T15:00:09Z",
        "source_event_ids": ["evt-006", "evt-009"],
        "evidence_ids": ["evd-004"]
      }
    ],
    "edges": [],
    "current_topic": {
      "primary_topic_id": null,
      "mode": "derived",
      "source_event_ids": []
    }
  }
}

