{
  "session": {
    "id": "s-005",
    "title": "Action Item",
    "goal": "Actionの抽出境界を確認する",
    "status": "active",
    "created_at": "2026-09-19T14:00:00Z",
    "started_at": "2026-09-19T14:00:00Z",
    "ended_at": null,
    "graph_revision": 6
  },
  "evidence": [
    {
      "id": "evd-001",
      "session_id": "s-005",
      "sequence": 1,
      "timestamp": "2026-09-19T14:00:01Z",
      "speaker": "A",
      "text": "次回までにVisual Prototypeを作ります"
    },
    {
      "id": "evd-002",
      "session_id": "s-005",
      "sequence": 2,
      "timestamp": "2026-09-19T14:00:02Z",
      "speaker": "B",
      "text": "Visual Prototypeも作った方がいいかもしれません"
    },
    {
      "id": "evd-003",
      "session_id": "s-005",
      "sequence": 3,
      "timestamp": "2026-09-19T14:00:03Z",
      "speaker": "B",
      "text": "山田さん、2026-09-25までにPrototypeお願いします"
    }
  ],
  "utterances": [
    {
      "id": "utt-001",
      "session_id": "s-005",
      "sequence": 1,
      "evidence_ids": ["evd-001"],
      "text": "次回までにVisual Prototypeを作ります",
      "started_at": "2026-09-19T14:00:01Z",
      "ended_at": "2026-09-19T14:00:01Z"
    },
    {
      "id": "utt-002",
      "session_id": "s-005",
      "sequence": 2,
      "evidence_ids": ["evd-002"],
      "text": "Visual Prototypeも作った方がいいかもしれません",
      "started_at": "2026-09-19T14:00:02Z",
      "ended_at": "2026-09-19T14:00:02Z"
    },
    {
      "id": "utt-003",
      "session_id": "s-005",
      "sequence": 3,
      "evidence_ids": ["evd-003"],
      "text": "山田さん、2026-09-25までにPrototypeお願いします",
      "started_at": "2026-09-19T14:00:03Z",
      "ended_at": "2026-09-19T14:00:03Z"
    }
  ],
  "graph": {
    "session_id": "s-005",
    "revision": 6,
    "last_event_sequence": 6,
    "nodes": [
      {
        "id": "node:s-005:evt-003",
        "session_id": "s-005",
        "type": "action",
        "label": "Visual Prototypeを作成する",
        "status": "active",
        "created_at": "2026-09-19T14:00:03Z",
        "updated_at": "2026-09-19T14:00:03Z",
        "source_event_ids": ["evt-003"],
        "evidence_ids": ["evd-001"],
        "action": {
          "description": "Visual Prototypeを作成する",
          "owner": null,
          "due_date": null,
          "status": "open"
        }
      },
      {
        "id": "node:s-005:evt-004",
        "session_id": "s-005",
        "type": "open_item",
        "label": "Visual Prototypeを作るべきか",
        "status": "active",
        "created_at": "2026-09-19T14:00:04Z",
        "updated_at": "2026-09-19T14:00:04Z",
        "source_event_ids": ["evt-004"],
        "evidence_ids": ["evd-002"]
      },
      {
        "id": "node:s-005:evt-005",
        "session_id": "s-005",
        "type": "action",
        "label": "Prototypeを期限までに作成する",
        "status": "active",
        "created_at": "2026-09-19T14:00:05Z",
        "updated_at": "2026-09-19T14:00:06Z",
        "source_event_ids": ["evt-005", "evt-006"],
        "evidence_ids": ["evd-003"],
        "action": {
          "description": "Prototypeを期限までに作成する",
          "owner": "山田さん",
          "due_date": "2026-09-26",
          "status": "open"
        }
      }
    ],
    "edges": [],
    "current_topic": {
      "primary_topic_id": null,
      "mode": "derived",
      "source_event_ids": []
    }
  }
}
