{
  "session": {
    "id": "s-009",
    "title": "Undo",
    "goal": "最新Human CorrectionのUndoを確認する",
    "status": "active",
    "created_at": "2026-09-19T18:00:00Z",
    "started_at": "2026-09-19T18:00:00Z",
    "ended_at": null,
    "graph_revision": 5
  },
  "evidence": [
    {
      "id": "evd-001",
      "session_id": "s-009",
      "sequence": 1,
      "timestamp": "2026-09-19T18:00:01Z",
      "speaker": "AI",
      "text": "MVP範囲"
    }
  ],
  "utterances": [
    {
      "id": "utt-001",
      "session_id": "s-009",
      "sequence": 1,
      "evidence_ids": ["evd-001"],
      "text": "MVP範囲",
      "started_at": "2026-09-19T18:00:01Z",
      "ended_at": "2026-09-19T18:00:01Z"
    }
  ],
  "graph": {
    "session_id": "s-009",
    "revision": 5,
    "last_event_sequence": 5,
    "nodes": [
      {
        "id": "node:s-009:evt-003",
        "session_id": "s-009",
        "type": "topic",
        "label": "MVP範囲",
        "status": "active",
        "created_at": "2026-09-19T18:00:03Z",
        "updated_at": "2026-09-19T18:00:05Z",
        "source_event_ids": ["evt-003", "evt-004", "evt-005"],
        "evidence_ids": ["evd-001"]
      }
    ],
    "edges": [],
    "current_topic": {
      "primary_topic_id": null,
      "mode": "derived",
      "source_event_ids": []
    }
  }
}

